{
"integration_mode": "new",
"language_framework": "python",
"type_of_transaction": "salesreceipt",
"typing_system": "hints (dataclasses)",
"transaction_creation_instructions": "Create {{type_of_transaction}} with default item id : 1 and default customer : 1 and {{type_of_transaction}} amount: 111. ",
"markup_percentages": 30,
"project_estimate_creation_instructions": "Create an estimate with default item id : 1 ,UnitPrice: 1, Qty: 100, and ItemAccountRef=5. Amount=UnitPrice*Qty. CostAmount in the line should be {{markup_percentages}} percent more or less than the Amount. ",
"graphql_endpoint_production": "https://qb.api.intuit.com/graphql",
"graphql_endpoint_sandbox": "https://qb-sandbox.api.intuit.com/graphql",
"graphql_schema" : "https://developer.intuit.com/app/developer/gql/docs/api/qbexternal/queries/",
"create_dimension_qbo_ui" : "https://qbo.intuit.com/app/class",
"rest_baseurl_production": "quickbooks.api.intuit.com",
"rest_baseurl_sandbox": "qb-sandbox.api.intuit.com",
"custom_extensions_structure": "[\n  {\n    \"CustomExtensions\": [\n      {\n        \"AssociatedValues\": [\n          {\n            \"Value\": \"{{Value_ID}}\",\n            \"Key\": \"{{Definition_ID}}\"\n          }\n        ],\n        \"ExtensionType\": \"DIMENSION\"\n      }\n    ]\n  }\n]",
"transaction_v3_api_endpoint": "POST /v3/company/{{companyid}}/{{type_of_transaction}}?minorversion=75",
"transaction_v3_estimate_api_endpoint": "POST /v3/company/{{companyid}}/estimate?minorversion=75",
"get_transaction_endpoint": "GET /v3/company/{{companyid}}/{{type_of_transaction}}/{{TransactionId}}",
"get_estimate_transaction_endpoint": "GET /v3/company/{{companyid}}/estimate/{{TransactionId}}",
"company_info_rest_v3_api_endpoint": "GET /v3/company/{{companyid}}/query?minorversion={{minorversion}}&query=select * from CompanyInfo",
"company_preferences_rest_v3_api_endpoint": "GET /v3/company/{{companyid}}/query?minorversion={{minorversion}}&query=select * from preferences",
"dimension_Api_documentation": "https://developer.intuit.com/app/developer/ies/docs/workflows/manage-dimensions/dimensions-use-cases",
"project-estimate-documentation": "https://developer.intuit.com/app/developer/qbo/docs/workflows/manage-projects/use-cases#use-case-5",
"rest_v3_api_documentation": "https://developer.intuit.com/app/developer/qbo/docs/api/accounting/all-entities/account",
"dimension_discovery_query": "query ActiveCustomDimensionDefinitionsQuery {\n  appFoundationsActiveCustomDimensionDefinitions(\n    first: 20\n    after: null\n    last: null\n    before: null\n  ) {\n    edges {\n      node {\n        ...CustomDimensionDefinitionAttributes\n      }\n    }\n  }\n}\nfragment CustomDimensionDefinitionAttributes on AppFoundations_CustomDimensionDefinition {\n  id\n  label\n  active\n}",
"dimension_values_query": "query CustomDimensionsValuesQuery {\n  appFoundationsActiveCustomDimensionValues(\n    first: 20,\n    filters: { definitionId: \"1000000002\", parentId: null }\n  ) {\n    edges {\n      node {\n        id\n        definitionId\n        fullyQualifiedLabel\n      }\n    }\n  }\n}",
"projects_discovery_query": "{\"query\":\"query projectManagementProjects($first: PositiveInt!,$after: String,$filter: ProjectManagement_ProjectFilter!,$orderBy: [ProjectManagement_OrderBy!]){projectManagementProjects(first: $first,after: $after,filter: $filter,orderBy: $orderBy){edges{node{id,name,status,dueDate,customer{id},account{id}}}pageInfo{hasNextPage,hasPreviousPage,startCursor,endCursor}}}\",\"variables\":{\"first\":4,\"filter\":{\"status\":{\"in\":[\"OPEN\",\"IN_PROGRESS\"]}},\"orderBy\":[\"DUE_DATE_ASC\"]}}",
"project_creation_query": "{\"query\":\"mutation ProjectManagementCreateProject($name: String!,$customer: ProjectManagement_CustomerInput,$status: ProjectManagement_Status){projectManagementCreateProject(input:{name: $name,customer: $customer,status: $status}){... on ProjectManagement_Project {id,name,customer{id},account{id},status}}}\",\"variables\":{\"name\":\"Red testing via API\",\"customer\":{\"id\":\"32\"},\"status\":\"OTHER\"}}",
"php-sdk-documentation":"https://developer.intuit.com/app/developer/qbo/docs/develop/sdks-and-samples-collections/php/install-the-php-sdk AND https://developer.intuit.com/app/developer/qbo/docs/develop/sdks-and-samples-collections/php",
"oauth2-documentation":"https://developer.intuit.com/app/developer/qbo/docs/develop/authentication-and-authorization/oauth-2.0",
"java-sdk-official": "https://central.sonatype.com/search?q=g:com.intuit.quickbooks-online&smo=true",
"java-sdk-dependency":"Graddle",
"java-sdk-documentation": "https://developer.intuit.com/app/developer/qbo/docs/develop/sdks-and-samples-collections/java/install-the-java-sdk#jar-files",
"minorversion":"75"
}
